{
  "formatVersion": 1,
  "id": "bbbbbbbb-bbbb-bbbb-bbbb-bbbbbbbbbbbb",
  "name": "Village",
  "width": 960,
  "height": 544,
  "entities": [
    {
      "id": "cccccccc-cccc-cccc-cccc-cccccccccccc",
      "name": "Player",
      "transform": {
        "x": 224,
        "y": 120,
        "width": 32,
        "height": 32
      },
      "spriteRenderer": {
        "color": "#4DA6FFFF",
        "visible": true
      }
    },
    {
      "id": "dddddddd-dddd-dddd-dddd-dddddddddddd",
      "name": "Guide",
      "transform": {
        "x": 300,
        "y": 112,
        "width": 32,
        "height": 40
      },
      "spriteRenderer": {
        "color": "#FFB347FF",
        "visible": true
      }
    }
  ]
}
